versions.json

[{"version": "26.08", "title": "26.08", "aliases": ["latest"]}, {"version": "26.05", "title": "26.05", "aliases": []}, {"version": "26.02", "title": "26.02", "aliases": []}, {"version": "25.11", "title": "25.11", "aliases": []}, {"version": "25.08", "title": "25.08", "aliases": []}, {"version": "25.05", "title": "25.05", "aliases": []}, {"version": "25.02", "title": "25.02", "aliases": []}, {"version": "24.11.1", "title": "24.11.1", "aliases": []}, {"version": "24.11", "title": "24.11", "aliases": []}, {"version": "24.08", "title": "24.08", "aliases": []}, {"version": "24.05", "title": "24.05", "aliases": []}, {"version": "24.02", "title": "24.02", "aliases": []}, {"version": "23.11", "title": "23.11", "aliases": []}, {"version": "23.08", "title": "23.08", "aliases": []}, {"version": "23.05", "title": "23.05", "aliases": []}, {"version": "23.02", "title": "23.02", "aliases": []}, {"version": "22.11", "title": "22.11", "aliases": []}, {"version": "nightly", "title": "nightly", "aliases": []}]

CHANGELOG.md

## 26.02.0 / 2026-02-11 Release

- **IMPORTANT** KeyPerf is the default collector for volume performance metrics starting in `25.11` and this release `26.02` fixes an issue where KeyPerf Collector did not calculate FlexGroup latency.

## Announcements

:bangbang: **IMPORTANT** Release `24.05` removes duplicate quota metrics. If you wish to enable them, refer [here](https://github.com/NetApp/harvest/discussions/2895).

:bangbang: **IMPORTANT** Release `24.02` disables four templates that collected metrics not used in dashboards.
These four templates are disabled by default: `ObjectStoreClient`, `TokenManager`, `OntapS3SVM`, and `Vscan`.
This change was made to reduce the number of collected metrics.
If you require these templates, you can enable them by uncommenting them in their corresponding `default.yaml` or by extending the [existing object template](https://netapp.github.io/harvest/latest/configure-templates/#extend-an-existing-object-template).

### :closed_book: Documentation

- Fix Service Latency ([#2492](https://github.com/NetApp/harvest/pull/2492))
- Fix Doc Link From Changelog Dashboard ([#2510](https://github.com/NetApp/harvest/pull/2510))
- How To Use Harvest With Rest Private Cli ([#2523](https://github.com/NetApp/harvest/pull/2523))
- Add Docker Logging Configuration Guide ([#2524](https://github.com/NetApp/harvest/pull/2524))
- Mention Iec Is Base2 And Source ([#2527](https://github.com/NetApp/harvest/pull/2527))
- Change Link From Netapp.io To Github ([#2533](https://github.com/NetApp/harvest/pull/2533))
- Steps To Create Custom Grafana Dashboard ([#2550](https://github.com/NetApp/harvest/pull/2550))
- Add Type And Base For Qos Detail Metrics ([#2557](https://github.com/NetApp/harvest/pull/2557))
- Ems Doc Update ([#2561](https://github.com/NetApp/harvest/pull/2561))
- Unit For Nfs Throughput Should Be B_per_sec ([#2562](https://github.com/NetApp/harvest/pull/2562))
- Consolidate Upgrade Steps With Install ([#2567](https://github.com/NetApp/harvest/pull/2567))
- Bump The Minimum Prometheus Version To 2.33 ([#2569](https://github.com/NetApp/harvest/pull/2569))
- Add Restart Information In Power Document ([#2572](https://github.com/NetApp/harvest/pull/2572))
- Add Rest Strategy Under Left Nav ([#2578](https://github.com/NetApp/harvest/pull/2578))
- Add Rest Permissions ([#2604](https://github.com/NetApp/harvest/pull/2604))
- Add Fsa Template Description ([#2606](https://github.com/NetApp/harvest/pull/2606))
- Update Grafana Datasource Docs ([#2614](https://github.com/NetApp/harvest/pull/2614))
- Add Vserver For Rest Role Creation ([#2620](https://github.com/NetApp/harvest/pull/2620))
- Fix Broken Link And Remove Todo ([#2624](https://github.com/NetApp/harvest/pull/2624))
- Harvest Should Describe High-Level Concepts ([#2625](https://github.com/NetApp/harvest/pull/2625))
- Add doctor print commands for each platform ([2670](https://github.com/NetApp/harvest/pull/2670))
- Release 24.02 metric docs ([#2694](https://github.com/NetApp/harvest/pull/2694))
- Debian upgrade documentation ([#2699](https://github.com/NetApp/harvest/pull/2699))

## Announcements

:bangbang: **IMPORTANT** Release `23.11` disables the `CIFSSession` templates by default. This change was made to prevent the generation of a large number of metrics. If you require these templates, you can enable them. Please be aware that enabling them may result in a significant increase in metric collection time, Harvest memory footprint, and Prometheus used disk space. These metrics are utilized in the SMB2 dashboard.

:bangbang: **IMPORTANT** Release `23.11` has updated its power metric calculation algorithm. As a result, you may notice a decrease in the reported power metrics compared to previous versions. To collect these metrics, Rest API permissions are required. For detailed information on the power algorithm, please refer to the power algorithm [documentation](https://netapp.github.io/harvest/latest/resources/power-algorithm/).

:bangbang: **IMPORTANT** `23.08` fixes a REST collector bug that caused partial data collection when ONTAP paginated results. See #2109 for details.

:bangbang: **IMPORTANT** Release `23.08` disables the `NetConnections` and `NFSClients` templates by default. You can enable them if needed. These templates were disabled because several customers reported that these templates created millions of metrics. None of these metrics are used in Harvest dashboards.

:bangbang: **IMPORTANT** Release `23.08` changes how Harvest monitors workloads. For detailed information, please refer to the discussion #2265.

### :closed_book: Documentation

- Explain Bin/Grafana Import --Labels ([#2032](https://github.com/NetApp/harvest/pull/2032))
- Update Release Checklist ([#2043](https://github.com/NetApp/harvest/pull/2043))
- Update Docker Compose Generation Process To Remove Binary Dependencies ([#2046](https://github.com/NetApp/harvest/pull/2046))
- Add Details About Volume Sis Stat Panel ([#2047](https://github.com/NetApp/harvest/pull/2047))
- Add Harvest-Metrics Release Branch Creation For Release Steps ([#2050](https://github.com/NetApp/harvest/pull/2050))
- Fix Rest Template Extend Instructions Path ([#2051](https://github.com/NetApp/harvest/pull/2051))
- Fsx Does Not Support Headroom Dashboard ([#2131](https://github.com/NetApp/harvest/pull/2131))
- Update Fsa Dashboard Doc ([#2159](https://github.com/NetApp/harvest/pull/2159))
- Move K8 Podman Document To Documentation Site ([#2160](https://github.com/NetApp/harvest/pull/2160))
- Clarify How To Tell Harvest To Continue Using The Zapi Protocol ([#2162](https://github.com/NetApp/harvest/pull/2162))
- Clarify Generic Vs Custom Plugins ([#2166](https://github.com/NetApp/harvest/pull/2166))
- Update Docker Docs Link To Doc Site ([#2186](https://github.com/NetApp/harvest/pull/2186))
- Clarify Which Version Of Go Is Required ([#2214](https://github.com/NetApp/harvest/pull/2214))
- Give Authentication Precedence Its Own Section ([#2226](https://github.com/NetApp/harvest/pull/2226))
- Add Note About Workload Counter In Default Templates ([#2230](https://github.com/NetApp/harvest/pull/2230))
- Simplify The Preparing Ontap Cdot Cluster Documentation ([#2231](https://github.com/NetApp/harvest/pull/2231))
- Fix Ems Link ([#2244](https://github.com/NetApp/harvest/pull/2244))
- Update Metric Generate Step Command ([#2279](https://github.com/NetApp/harvest/pull/2279))
- Move Troubleshoot Docs To Doc Site ([#2287](https://github.com/NetApp/harvest/pull/2287))
- Release 23.08 Metric Docs ([#2290](https://github.com/NetApp/harvest/pull/2290))

## Announcements

**IMPORTANT** The `volume_aggr_labels` metric is being deprecated in the `23.05` release and will be removed in the `23.08` release of Harvest ([#1966](https://github.com/NetApp/harvest/pull/1966)) `volume_aggr_labels` is redundant and the same labels are already available via `volume_labels`.

**IMPORTANT** To reduce image and download size, several tools were combined in `23.05`. The following binaries are no longer included: `bin/grafana`, `bin/rest`, `bin/zapi`. Use `bin/harvest grafana`, `bin/harvest rest`, and `bin/harvest zapi` instead.